{
  "$schema":"https://json-schema.org/draft/2020-12/schema","$id":"https://notrios.dev/schemas/archive-v2/index-entry.schema.json","type":"object","additionalProperties":false,"required":["sha256","kind","media_type","size_bytes","location"],"properties":{"sha256":{"type":"string","pattern":"^[0-9a-f]{64}$"},"kind":{"enum":["records","blob","pack"]},"media_type":{"type":"string","minLength":1,"maxLength":255},"size_bytes":{"type":"integer","minimum":0,"maximum":17179869184},"records":{"type":"integer","minimum":0,"maximum":10000},"record_counts":{"$ref":"#/$defs/counts"},"location":{"$ref":"#/$defs/location"}},"$defs":{"sha":{"type":"string","pattern":"^[0-9a-f]{64}$"},"location":{"type":"object","additionalProperties":false,"required":["layout"],"properties":{"layout":{"enum":["fanout","pack"]},"path":{"type":"string","maxLength":255},"pack_sha256":{"$ref":"#/$defs/sha"},"offset":{"type":"integer","minimum":0},"length":{"type":"integer","minimum":0}}},"counts":{"type":"object","additionalProperties":false,"required":["collections","notebooks","search_notebooks","tags","documents","revisions","document_tags","resources","document_resources","links","provenance","source_bundles"],"properties":{"collections":{"type":"integer","minimum":0},"notebooks":{"type":"integer","minimum":0},"search_notebooks":{"type":"integer","minimum":0},"tags":{"type":"integer","minimum":0},"documents":{"type":"integer","minimum":0},"revisions":{"type":"integer","minimum":0},"document_tags":{"type":"integer","minimum":0},"resources":{"type":"integer","minimum":0},"document_resources":{"type":"integer","minimum":0},"links":{"type":"integer","minimum":0},"provenance":{"type":"integer","minimum":0},"source_bundles":{"type":"integer","minimum":0}}}}
}
